tweet_id,in_reply_to_status_id,in_reply_to_user_id,timestamp,source,text,retweeted_status_id,retweeted_status_user_id,expanded_urls,rating_numerator,rating_denominator,name,doggo,floofer,pupper,puppo,stage,calculated_rating,most_likely_breed,retweet_count,favorite_count
6.81193E+17,,,12/27/2015 19:22,Twitter for iPhone,This is Aspen. He's astronomically fluffy. I wouldn't stop petting this dog if the world was ending around me 11/10 https://t.co/oBlgL9nxpx,,,"https://twitter.com/dog_rates/status/681193455364796417/photo/1,https://twitter.com/dog_rates/status/681193455364796417/photo/1",11,10,Aspen,,,,,,1.1,Pomeranian,1333,3407
6.80971E+17,,,12/27/2015 4:37,Twitter for iPhone,I thought I made this very clear. We only rate dogs. Stop sending other things like this shark. Thank you... 9/10 https://t.co/CXSJZ4Stk3,,,https://twitter.com/dog_rates/status/680970795137544192/photo/1,9,10,,,,,,,0.9,pug,583,2208
6.80959E+17,,,12/27/2015 3:51,Twitter for iPhone,This is Ozzie. He was doing fine until he lost traction in those festive socks. Now he's tired. 9/10 still killin it https://t.co/u4FYdIRKnY,,,"https://twitter.com/dog_rates/status/680959110691590145/photo/1,https://twitter.com/dog_rates/status/680959110691590145/photo/1,https://twitter.com/dog_rates/status/680959110691590145/photo/1",9,10,Ozzie,,,,,,0.9,pug,1818,4212
6.8094E+17,,,12/27/2015 2:36,Twitter for iPhone,This is Alice. She's an idiot. 4/10 https://t.co/VQXdwJfkyS,,,https://twitter.com/dog_rates/status/680940246314430465/photo/1,4,10,Alice,,,,,,0.4,soft-coated_wheaten_terrier,935,2921
6.80935E+17,,,12/27/2015 2:15,Twitter for iPhone,Say hello to Sadie. She's a Tortellini Sidewinder. Very jubilant pup. Seems loyal. Leaves on point. 10/10 petable af https://t.co/g2bTu4ayPl,,,https://twitter.com/dog_rates/status/680934982542561280/photo/1,10,10,Sadie,,,,,,1,Labrador_retriever,391,1912
6.80913E+17,,,12/27/2015 0:49,Twitter for iPhone,Meet Griswold. He's dapper as hell. Already pumped for next Christmas. 11/10 https://t.co/5NrpNDyFzN,,,https://twitter.com/dog_rates/status/680913438424612864/photo/1,11,10,Griswold,,,,,,1.1,Pomeranian,562,2208
6.8089E+17,,,12/26/2015 23:15,Twitter for iPhone,This is Cheesy. It's her birthday. She's patiently waiting to eat her party muffin. 9/10 happy birthday pup https://t.co/cH2H7mch2H,,,https://twitter.com/dog_rates/status/680889648562991104/photo/1,9,10,Cheesy,,,,,,0.9,Shetland_sheepdog,323,1609
6.80836E+17,,,12/26/2015 19:43,Twitter for iPhone,This is Ellie. She's secretly ferocious. 12/10 very deadly pupper https://t.co/BF4BW8LUgb,,,"https://twitter.com/dog_rates/status/680836378243002368/photo/1,https://twitter.com/dog_rates/status/680836378243002368/photo/1,https://twitter.com/dog_rates/status/680836378243002368/photo/1",12,10,Ellie,,,pupper,,pupper,1.2,Pembroke,1183,3181
6.80802E+17,,,12/26/2015 17:25,Twitter for iPhone,Great picture here. Dog on the right panicked &amp; forgot about his tongue. Middle green dog must've fainted. All 10/10 https://t.co/31npKUAox0,,,https://twitter.com/dog_rates/status/680801747103793152/photo/1,10,10,,,,,,,1,pug,739,2185
6.80798E+17,,,12/26/2015 17:12,Twitter for iPhone,Say hello to Moofasa. He must be a powerful dog. Fenced in for your protection. Just got his ear pierced. 6/10 https://t.co/w6fRfQ3RXD,,,https://twitter.com/dog_rates/status/680798457301471234/photo/1,6,10,Moofasa,,,,,,0.6,,937,2599
6.80609E+17,,,12/26/2015 4:41,Twitter for iPhone,This is Brody. That is his chair. He loves his chair. Never leaves it. 9/10 might be stuck actually https://t.co/WvJRg0XJit,,,https://twitter.com/dog_rates/status/680609293079592961/photo/1,9,10,Brody,,,,,,0.9,French_bulldog,624,2409
6.80584E+17,,,12/26/2015 3:00,Twitter for iPhone,This is Penny. Her tennis ball slowly rolled down her cone and into the pool. 8/10 bad things happen to good puppers https://t.co/YNWU7LeFgg,,,"https://twitter.com/dog_rates/status/680583894916304897/photo/1,https://twitter.com/dog_rates/status/680583894916304897/photo/1,https://twitter.com/dog_rates/status/680583894916304897/photo/1,https://twitter.com/dog_rates/status/680583894916304897/photo/1",8,10,Penny,,,,,,0.8,,1186,3299
6.80498E+17,,,12/25/2015 21:18,Twitter for iPhone,Meet Percy. He's a Latvian Yuletide Heineken. Refuses to take off sweater. Kinda feisty. 12/10 would keep in pocket https://t.co/QGM5Fcuv7s,,,https://twitter.com/dog_rates/status/680497766108381184/photo/1,12,10,Percy,,,,,,1.2,Chihuahua,1729,3884
6.80495E+17,,,12/25/2015 21:06,Twitter for iPhone,Here we have uncovered an entire battalion of holiday puppers. Average of 11.26/10 https://t.co/eNm2S6p9BD,,,https://twitter.com/dog_rates/status/680494726643068929/photo/1,26,10,,,,,,,2.6,kuvasz,438,1573
6.80473E+17,,,12/25/2015 19:39,Twitter for iPhone,"This is Hector. He thinks he's a hammer. Silly Hector. You're a pupper, not a hammer. 10/10 https://t.co/OdUFuZIXiI",,,https://twitter.com/dog_rates/status/680473011644985345/photo/1,10,10,Hector,,,pupper,,pupper,1,Lakeland_terrier,669,2342
6.8044E+17,,,12/25/2015 17:30,Twitter for iPhone,Merry Christmas. My gift to you is this tiny unicorn running into a wall in slow motion. 11/10 https://t.co/UKqIAnR3He,,,https://twitter.com/dog_rates/status/680440374763077632/video/1,11,10,,,,,,,1.1,,440,1322
6.80221E+17,,,12/25/2015 3:00,Twitter for iPhone,This is CeCe. She's patiently waiting for Santa. 10/10 https://t.co/ZJUypFFwvg,,,https://twitter.com/dog_rates/status/680221482581123072/photo/1,10,10,CeCe,,,,,,1,,260,1356
6.80207E+17,,,12/25/2015 2:01,Twitter for iPhone,I hope everyone enjoys this picture as much as I do. This is Toby. 12/10 https://t.co/vHnu1g9EJm,,,https://twitter.com/dog_rates/status/680206703334408192/photo/1,12,10,Toby,,,,,,1.2,,1043,2583
6.80191E+17,,,12/25/2015 1:00,Twitter for iPhone,Here's a sleepy Christmas pupper 11/10 https://t.co/KXg0f8GNQ9,,,https://twitter.com/dog_rates/status/680191257256136705/photo/1,11,10,,,,pupper,,pupper,1.1,Brittany_spaniel,441,1976
6.80176E+17,,,12/25/2015 0:00,Twitter for iPhone,This pupper is patiently waiting to scare the shit out of Santa. 10/10 https://t.co/NhXo67K6yt,,,https://twitter.com/dog_rates/status/680176173301628928/photo/1,10,10,,,,pupper,,pupper,1,,1392,3553
6.80161E+17,,,12/24/2015 23:00,Twitter for iPhone,Meet Goliath. He's an example of irony. Head is phenomenally round. Wants to be an ornament. 12/10 would hug gently https://t.co/72Dil0Aktw,,,https://twitter.com/dog_rates/status/680161097740095489/photo/1,12,10,Goliath,,,,,,1.2,bluetick,669,2136
6.80146E+17,,,12/24/2015 22:00,Twitter for iPhone,Say hello to Kawhi. He was doing fine until his hat fell off. He got it back though. 10/10 deep breaths pupper https://t.co/N5pM6WBx7e,,,"https://twitter.com/dog_rates/status/680145970311643136/photo/1,https://twitter.com/dog_rates/status/680145970311643136/photo/1,https://twitter.com/dog_rates/status/680145970311643136/photo/1",10,10,Kawhi,,,pupper,,pupper,1,miniature_poodle,1557,3310
6.80131E+17,,,12/24/2015 21:00,Twitter for iPhone,This is Reggie. His Santa hat is a little big. 10/10 he's still having fun https://t.co/w0dcGXq7qK,,,https://twitter.com/dog_rates/status/680130881361686529/photo/1,10,10,Reggie,,,,,,1,Maltese_dog,854,2112
6.80116E+17,,,12/24/2015 20:00,Twitter for iPhone,This is Ozzy. He woke up 2 minutes before he had to be ready for the Christmas party. 9/10 classic Ozzy https://t.co/Kt9vmw0Fap,,,https://twitter.com/dog_rates/status/680115823365742593/photo/1,9,10,Ozzy,,,,,,0.9,pug,822,2494
6.80101E+17,,,12/24/2015 19:00,TweetDeck,This pupper is not coming inside until she catches a snowflake on her tongue. 11/10 the determination is palpable https://t.co/lvMYbmKq8H,,,https://twitter.com/dog_rates/status/680100725817409536/photo/1,11,10,,,,pupper,,pupper,1.1,golden_retriever,1246,3300
6.80086E+17,,,12/24/2015 18:00,TweetDeck,This is by far the most coordinated series of pictures I was sent. Downright impressive in every way. 12/10 for all https://t.co/etzLo3sdZE,,,"https://twitter.com/dog_rates/status/680085611152338944/photo/1,https://twitter.com/dog_rates/status/680085611152338944/photo/1,https://twitter.com/dog_rates/status/680085611152338944/photo/1",12,10,by,,,,,,1.2,,8125,11721
6.80071E+17,,,12/24/2015 17:00,TweetDeck,Say hello to Emmie. She's trapped in an ornament. Tragic af. Looks pretty content tho. Maybe it's meant to be. 9/10 https://t.co/Fh7geodBCU,,,https://twitter.com/dog_rates/status/680070545539371008/photo/1,9,10,Emmie,,,,,,0.9,Shih-Tzu,771,2382
6.79877E+17,,,12/24/2015 4:11,Twitter for iPhone,Meet Penelope. She's a bacon frise. Total babe (lol get it like the movie). Doesn't bark tho. 5/10 very average dog https://t.co/SDcQYg0HSZ,,,https://twitter.com/dog_rates/status/679877062409191424/photo/1,5,10,Penelope,,,,,,0.5,,576,1791
6.79862E+17,,,12/24/2015 3:12,Twitter for iPhone,"""Dammit hooman I'm jus trynna lik the fler"" 11/10 https://t.co/eRZRI8OTj7",,,https://twitter.com/dog_rates/status/679862121895714818/photo/1,11,10,,,,,,,1.1,EntleBucher,554,2246
6.79855E+17,,,12/24/2015 2:42,Twitter for iPhone,This is Bruce. He's a rare pup. Covered in Frosted Flakes. Nifty gold teeth. Overall good dog. 7/10 would pet firmly https://t.co/RtxxACzZ8A,,,https://twitter.com/dog_rates/status/679854723806179328/photo/1,7,10,Bruce,,,,,,0.7,chow,1099,2611
6.79844E+17,,,12/24/2015 2:02,Twitter for iPhone,This is Willie. He's floating away and needs your assistance. Please someone help Willie. 10/10 https://t.co/MJqygWqt8X,,,https://twitter.com/dog_rates/status/679844490799091713/photo/1,10,10,Willie,,,,,,1,Airedale,687,2186
6.79828E+17,,,12/24/2015 0:58,Twitter for iPhone,Everybody look at this beautiful pupper 13/10 https://t.co/hyAC5Hq9GC,,,"https://twitter.com/dog_rates/status/679828447187857408/photo/1,https://twitter.com/dog_rates/status/679828447187857408/photo/1,https://twitter.com/dog_rates/status/679828447187857408/photo/1",13,10,,,,pupper,,pupper,1.3,Chihuahua,12549,33085
6.79778E+17,,,12/23/2015 21:37,Twitter for iPhone,This is Rinna. She's melting. 10/10 get inside pupper https://t.co/PA0czwucsb,,,https://twitter.com/dog_rates/status/679777920601223168/photo/1,10,10,Rinna,,,pupper,,pupper,1,bloodhound,995,2854
6.79736E+17,,,12/23/2015 18:51,Twitter for iPhone,This pup's name is Sabertooth (parents must be cool). Ears for days. Jumps unannounced. 9/10 would pet diligently https://t.co/iazoiNUviP,,,https://twitter.com/dog_rates/status/679736210798047232/photo/1,9,10,,,,,,,0.9,French_bulldog,714,1910
6.7973E+17,,,12/23/2015 18:25,Twitter for iPhone,This is Hunter. He was playing with his ball minding his own business. Has no idea what happened to the carpet. 8/10 https://t.co/DbUTDI3u1R,,,https://twitter.com/dog_rates/status/679729593985699840/photo/1,8,10,Hunter,,,,,,0.8,West_Highland_white_terrier,747,1991
6.79722E+17,,,12/23/2015 17:55,Twitter for iPhone,This is Mike. He is a Jordanian Frito Pilates. Frowning because he can't see directly in front of him. 8/10 https://t.co/NL5QJwdEpF,,,https://twitter.com/dog_rates/status/679722016581222400/photo/1,8,10,Mike,,,,,,0.8,boxer,425,1537
6.7953E+17,,,12/23/2015 5:13,Twitter for iPhone,Guys this really needs to stop. We've been over this way too many times. This is a giraffe. We only rate dogs.. 7/10 https://t.co/yavgkHYPOC,,,https://twitter.com/dog_rates/status/679530280114372609/photo/1,7,10,,,,,,,0.7,dalmatian,1880,4364
6.79528E+17,,,12/23/2015 5:03,Twitter for iPhone,This little pupper just arrived. 11/10 would snug https://t.co/DA5aqnSGfB,,,https://twitter.com/dog_rates/status/679527802031484928/photo/1,11,10,,,,pupper,,pupper,1.1,,649,2422
6.79511E+17,,,12/23/2015 3:58,Twitter for iPhone,Say hello to William. He makes fun of others because he's terrified of his own deep-seated insecurities. 7/10 https://t.co/bwuV6FlRxr,,,https://twitter.com/dog_rates/status/679511351870550016/photo/1,7,10,William,,,,,,0.7,Chihuahua,1143,3067
6.79503E+17,,,12/23/2015 3:26,Twitter for iPhone,This is Dwight. He's a pointy pupper. Very docile. Attracts marshmallows. Hurts to pet but definitely worth it 8/10 https://t.co/jjW7zTxY9Z,,,https://twitter.com/dog_rates/status/679503373272485890/photo/1,8,10,Dwight,,,pupper,,pupper,0.8,,1333,2907
6.79476E+17,,,12/23/2015 1:37,Twitter for iPhone,This is Evy. She doesn't want to be a Koala. 9/10 https://t.co/VITeF0Kl9L,,,https://twitter.com/dog_rates/status/679475951516934144/photo/1,9,10,Evy,,,,,,0.9,Maltese_dog,578,1921
6.79463E+17,,,12/23/2015 0:45,Twitter for iPhone,Meet Hurley. He's the curly one. He hugs every other dog he sees during his walk. 11/10 for spreading the love https://t.co/M6vqkt2GKV,,,https://twitter.com/dog_rates/status/679462823135686656/photo/1,11,10,Hurley,,,,,,1.1,toy_poodle,16951,29334
6.79158E+17,,,12/22/2015 4:35,Twitter for iPhone,This is Rubio. He has too much skin. 11/10 https://t.co/NLOHmlENag,,,https://twitter.com/dog_rates/status/679158373988876288/photo/1,11,10,Rubio,,,,,,1.1,pug,7218,19384
6.79149E+17,,,12/22/2015 3:57,Twitter for iPhone,I know everyone's excited for Christmas but that doesn't mean you can send in reindeer. We only rate dogs... 8/10 https://t.co/eWjWgbOCYL,,,https://twitter.com/dog_rates/status/679148763231985668/photo/1,8,10,,,,,,,0.8,Italian_greyhound,920,2551
6.79132E+17,,,12/22/2015 2:52,Twitter for iPhone,This is Louis. He's a river dancer. His friends think it's badass. All are very supportive. 10/10 for Louis https://t.co/qoIvjKMY58,,,https://twitter.com/dog_rates/status/679132435750195208/photo/1,10,10,Louis,,,,,,1,Scottish_deerhound,1034,2698
6.79111E+17,,,12/22/2015 1:28,Twitter for iPhone,This is officially the greatest yawn of all time. 12/10 https://t.co/4R0Cc0sLVE,,,https://twitter.com/dog_rates/status/679111216690831360/video/1,12,10,officially,,,,,,1.2,kelpie,2306,5416
6.79063E+17,,,12/21/2015 22:15,Twitter for iPhone,This is Chompsky. He lives up to his name. 11/10 https://t.co/Xl37lQEWd0,,,"https://twitter.com/dog_rates/status/679062614270468097/photo/1,https://twitter.com/dog_rates/status/679062614270468097/photo/1",11,10,Chompsky,,,,,,1.1,schipperke,7186,15456
6.79047E+17,,,12/21/2015 21:15,Twitter for iPhone,This dog doesn't know how to stairs. Quite tragic really. 9/10 get it together pup https://t.co/kTpr9PTMg1,,,https://twitter.com/dog_rates/status/679047485189439488/photo/1,9,10,,,,,,,0.9,golden_retriever,585,2054
6.78992E+17,,,12/21/2015 17:33,Twitter for iPhone,If your Monday isn't going so well just take a look at this. Both 12/10 https://t.co/GJT6SILPGU,,,https://twitter.com/dog_rates/status/678991772295516161/photo/1,12,10,,,,,,,1.2,Eskimo_dog,1015,2064
6.78969E+17,,,12/21/2015 16:04,Twitter for iPhone,Meet Lola. She's a Metamorphic Chartreuse. Plays with her food. Insubordinate and churlish. Exquisite hardwood 11/10 https://t.co/etpBNXwN7f,,,https://twitter.com/dog_rates/status/678969228704284672/photo/1,11,10,Lola,,,,,,1.1,Labrador_retriever,408,1498
6.788E+17,,,12/21/2015 4:52,Twitter for iPhone,Here's a pupper with some mean tan lines. Snazzy sweater though 12/10 https://t.co/DpCSVsl6vu,,,https://twitter.com/dog_rates/status/678800283649069056/photo/1,12,10,,,,pupper,,pupper,1.2,Labrador_retriever,816,2352
6.78798E+17,,,12/21/2015 4:44,Twitter for iPhone,This is Linda. She fucking hates trees. 7/10 https://t.co/blaY85FIxR,,,https://twitter.com/dog_rates/status/678798276842360832/photo/1,7,10,Linda,,,,,,0.7,Airedale,1027,3159
6.78775E+17,,,12/21/2015 3:12,Twitter for iPhone,This is Tug. He's not required to wear the cone he just wants his voice to project more clearly. 11/10 https://t.co/Sp739Ou2qx,,,https://twitter.com/dog_rates/status/678774928607469569/photo/1,11,10,Tug,,,,,,1.1,Pembroke,819,2571
6.78767E+17,,,12/21/2015 2:41,Twitter for iPhone,This is Mia. She makes awful decisions. 8/10 https://t.co/G6TQVgTcZz,,,https://twitter.com/dog_rates/status/678767140346941444/photo/1,8,10,Mia,,,,,,0.8,,1222,3219
6.78765E+17,,,12/21/2015 2:30,Twitter for iPhone,"Meet Wilson. He got caught humping the futon. He's like ""dude, help me out here"" 10/10 I'd help Wilson out https://t.co/m6XoclB0qv",,,https://twitter.com/dog_rates/status/678764513869611008/photo/1,10,10,Wilson,,,,,,1,Irish_terrier,413,1479
6.78755E+17,,,12/21/2015 1:53,Twitter for iPhone,This is Dash. He didn't think the water would be that cold. Damn it Dash it's December. Think a little. 10/10 https://t.co/NqcOwG8pxW,,,https://twitter.com/dog_rates/status/678755239630127104/photo/1,10,10,Dash,,,,,,1,malamute,2919,6467
6.7874E+17,,,12/21/2015 0:53,Twitter for iPhone,Meet Tango. He's a large dog. Doesn't care much for personal space. Owner isn't very accepting. Tongue slip. 6/10 https://t.co/p2T5kGebxe,,,https://twitter.com/dog_rates/status/678740035362037760/photo/1,6,10,Tango,,,,,,0.6,beagle,1484,3391
6.78676E+17,,,12/20/2015 20:38,Twitter for iPhone,Exotic pup here. Tail long af. Throat looks swollen. Might breathe fire. Exceptionally unfluffy 2/10 would still pet https://t.co/a8SqCaSo2r,,,https://twitter.com/dog_rates/status/678675843183484930/photo/1,2,10,,,,,,,0.2,,1315,2597
6.78643E+17,,,12/20/2015 18:29,Twitter for iPhone,Meet Grizz. He just arrived. Couldn't wait until Christmas. Worried bc he saw the swastikas on the carpet. 10/10 https://t.co/QBGwYrT7rv,,,https://twitter.com/dog_rates/status/678643457146150913/photo/1,10,10,Grizz,,,,,,1,Labrador_retriever,359,1877
6.78446E+17,,,12/20/2015 5:25,Twitter for iPhone,Touching scene here. Really stirs up the emotions. The bond between father &amp; son. So beautiful. 10/10 for both pups https://t.co/AJWJHov5gx,,,https://twitter.com/dog_rates/status/678446151570427904/photo/1,10,10,,,,,,,1,Staffordshire_bullterrier,1371,3651
6.78424E+17,,,12/20/2015 3:58,Twitter for iPhone,This is Crystal. She's a shitty fireman. No sense of urgency. People could be dying Crystal. 2/10 just irresponsible https://t.co/rtMtjSl9pz,,,https://twitter.com/dog_rates/status/678424312106393600/photo/1,2,10,Crystal,,,,,,0.2,Maltese_dog,2265,4990
6.7841E+17,,,12/20/2015 3:02,Twitter for iPhone,Say hello to Jerome. He can shoot french fries out of his mouth at insane speeds. Deadly af. 10/10 https://t.co/dIy88HwrX8,,,https://twitter.com/dog_rates/status/678410210315247616/photo/1,10,10,Jerome,,,,,,1,schipperke,1607,3819
6.784E+17,,,12/20/2015 2:20,Twitter for iPhone,This made my day. 12/10 please enjoy https://t.co/VRTbo3aAcm,,,https://twitter.com/dog_rates/status/678399652199309312/video/1,12,10,,,,,,,1.2,Bedlington_terrier,28482,73278
6.78397E+17,,,12/20/2015 2:09,Twitter for iPhone,These little fellas have opposite facial expressions. Both 12/10 https://t.co/LmThv0GWen,,,"https://twitter.com/dog_rates/status/678396796259975168/photo/1,https://twitter.com/dog_rates/status/678396796259975168/photo/1",12,10,,,,,,,1.2,Pembroke,372,1453
6.78389E+17,,,12/20/2015 1:38,Twitter for iPhone,"This is Bella. She just learned that her final grade in chem was a 92.49 
poor pupper 11/10 https://t.co/auOoKuoveM",,,https://twitter.com/dog_rates/status/678389028614488064/photo/1,11,10,Bella,,,pupper,,pupper,1.1,miniature_pinscher,380,1711
6.7838E+17,,,12/20/2015 1:03,Twitter for iPhone,This is Crumpet. He underestimated the snow. Quickly retreating. 10/10 https://t.co/a0Zx5LDFZa,,,https://twitter.com/dog_rates/status/678380236862578688/photo/1,10,10,Crumpet,,,,,,1,Samoyed,821,2236
6.78341E+17,,,12/19/2015 22:28,Twitter for iPhone,This pupper likes tape. 12/10 https://t.co/cSp6w5GWgm,,,https://twitter.com/dog_rates/status/678341075375947776/photo/1,12,10,,,,pupper,,pupper,1.2,golden_retriever,471,1572
6.78334E+17,,,12/19/2015 22:02,Twitter for iPhone,This is Rosie. She has a snazzy bow tie and a fin for a tail. Probably super fast underwater. Cool socks 10/10 https://t.co/GO76MdGBs0,,,https://twitter.com/dog_rates/status/678334497360859136/photo/1,10,10,Rosie,,,,,,1,Norfolk_terrier,222,1181
6.78279E+17,,,12/19/2015 18:19,Twitter for iPhone,Another spooky pupper here. Most definitely floating. No legs. Probably knows some dark magic. 10/10 very spooked https://t.co/JK8MByRzgj,,,https://twitter.com/dog_rates/status/678278586130948096/photo/1,10,10,,,,pupper,,pupper,1,Maltese_dog,5481,10398
6.78255E+17,,,12/19/2015 16:47,Twitter for iPhone,This is Jessifer. She is a Bismoth Teriyaki. Flowers being attacked by hurricanes on bandana (rad). 9/10 stellar pup https://t.co/nZhmRwZzWv,,,https://twitter.com/dog_rates/status/678255464182861824/photo/1,9,10,Jessifer,,,,,,0.9,Chihuahua,327,1448
6.78021E+17,,,12/19/2015 1:16,Twitter for iPhone,This is Reese. He likes holding hands. 12/10 https://t.co/cbLroGCbmh,,,https://twitter.com/dog_rates/status/678021115718029313/photo/1,12,10,Reese,,,,,,1.2,miniature_pinscher,5609,12347
6.77919E+17,,,12/18/2015 18:29,Twitter for iPhone,"""Everything looks pretty good in there. Make sure to brush your gums. Been flossing? How's school going?"" Both 10/10 https://t.co/lWL2IMJqLR",,,https://twitter.com/dog_rates/status/677918531514703872/photo/1,10,10,,,,,,,1,Eskimo_dog,364,1216
6.77895E+17,,,12/18/2015 16:56,Twitter for iPhone,Guys this was terrifying. Really spooked me up. We don't rate ghosts. We rate dogs. Please only send dogs... 9/10 https://t.co/EJImi1udYb,,,https://twitter.com/dog_rates/status/677895101218201600/photo/1,9,10,,,,,,,0.9,dalmatian,1839,4388
6.77717E+17,,,12/18/2015 5:06,Twitter for iPhone,IT'S PUPPERGEDDON. Total of 144/120 ...I think https://t.co/ZanVtAtvIq,,,https://twitter.com/dog_rates/status/677716515794329600/photo/1,144,120,,,,,,,1.2,chow,874,2783
6.777E+17,,,12/18/2015 4:00,Twitter for iPhone,This is Ralph. He's an interpretive dancer. 10/10 https://t.co/zoDdPyPFsa,,,https://twitter.com/dog_rates/status/677700003327029250/photo/1,10,10,Ralph,,,,,,1,Siberian_husky,1285,3110
6.77698E+17,,,12/18/2015 3:54,Twitter for iPhone,This is Sadie. She got her holidays confused. 9/10 damn it Sadie https://t.co/fm7HxOsuPK,,,https://twitter.com/dog_rates/status/677698403548192770/photo/1,9,10,Sadie,,,,,,0.9,Shih-Tzu,285,1118
6.77688E+17,,,12/18/2015 3:11,Twitter for iPhone,This was Cindy's face when she heard Susan forgot the snacks for after the kid's soccer game. 11/10 https://t.co/gzkuVGRgAD,,,https://twitter.com/dog_rates/status/677687604918272002/photo/1,11,10,,,,,,,1.1,Pembroke,753,2253
6.77674E+17,,,12/18/2015 2:17,Twitter for iPhone,Endangered triangular pup here. Could be a wizard. Caught mid-laugh. No legs. Just fluff. Probably a wizard. 9/10 https://t.co/GFVIHIod0Z,,,https://twitter.com/dog_rates/status/677673981332312066/photo/1,9,10,,,,,,,0.9,Maltese_dog,1345,3032
6.77662E+17,,,12/18/2015 1:31,Twitter for iPhone,"In honor of the new Star Wars movie. Here's Yoda pug. 12/10 pet really well, would I https://t.co/pvjdRn00XH",,,https://twitter.com/dog_rates/status/677662372920729601/photo/1,12,10,,,,,,,1.2,,841,1773
6.77644E+17,,,12/18/2015 0:18,Twitter for iPhone,This is a dog swinging. I really enjoyed it so I hope you all do as well. 11/10 https://t.co/Ozo9KHTRND,,,https://twitter.com/dog_rates/status/677644091929329666/video/1,11,10,,,,,,,1.1,Chihuahua,724,1708
6.77574E+17,,,12/17/2015 19:39,Twitter for iPhone,This is Sandy. He's sexually confused. Thinks he's a pigeon. Also an All-American cheese catcher. 10/10 so petable https://t.co/Htu8plSqEu,,,"https://twitter.com/dog_rates/status/677573743309385728/photo/1,https://twitter.com/dog_rates/status/677573743309385728/photo/1",10,10,Sandy,,,,,,1,,598,1934
6.77566E+17,,,12/17/2015 19:07,Twitter for iPhone,Contortionist pup here. Inside pentagram. Clearly worships Satan. Known to slowly push fragile stuff off tables 6/10 https://t.co/EX9oR55VMe,,,https://twitter.com/dog_rates/status/677565715327688705/photo/1,6,10,,,,,,,0.6,basset,410,1188
6.77558E+17,,,12/17/2015 18:34,Twitter for iPhone,Reckless pupper here. Not even looking at road. Absolute menace. No regard for fellow pupper lives. 10/10 still cute https://t.co/96IBkOYB7j,,,https://twitter.com/dog_rates/status/677557565589463040/photo/1,10,10,,,,pupper,,pupper,1,Shih-Tzu,1013,2214
6.77548E+17,,,12/17/2015 17:56,Twitter for iPhone,Not much to say here. I just think everyone needs to see this. 12/10 https://t.co/AGag0hFHpe,,,https://twitter.com/dog_rates/status/677547928504967168/photo/1,12,10,,,,,,,1.2,American_Staffordshire_terrier,3285,6307
6.7753E+17,,,12/17/2015 16:45,Twitter for iPhone,Say hello to Axel. He's a Black Chevy Pinot on wheels. 0 to 60 in 5.7 seconds (if downhill). 9/10 I call shotgun https://t.co/DKe9DBnnHE,,,https://twitter.com/dog_rates/status/677530072887205888/photo/1,9,10,Axel,,,,,,0.9,Staffordshire_bullterrier,203,966
6.77335E+17,,,12/17/2015 3:48,Twitter for iPhone,This dog gave up mid jump. 9/10 https://t.co/KmMv3Y2zI8,,,"https://twitter.com/dog_rates/status/677334615166730240/photo/1,https://twitter.com/dog_rates/status/677334615166730240/photo/1",9,10,,,,,,,0.9,Lakeland_terrier,251,1224
6.77332E+17,,,12/17/2015 3:36,Twitter for iPhone,Meet Humphrey. He's a Northern Polyp Viagra. One ear works. Face stuck like that. Always surprised. 9/10 petable af https://t.co/FS7eJQM2F4,,,https://twitter.com/dog_rates/status/677331501395156992/photo/1,9,10,Humphrey,,,,,,0.9,beagle,208,986
6.77329E+17,,,12/17/2015 3:26,Twitter for iPhone,This is Derek. All the dogs adore Derek. He's a great guy. 10/10 really solid pup https://t.co/KgcsGNb61s,,,https://twitter.com/dog_rates/status/677328882937298944/photo/1,10,10,Derek,,,,,,1,kelpie,1342,3329
6.77315E+17,,,12/17/2015 2:30,Twitter for iPhone,"Meet Tassy &amp; Bee. Tassy is pretty chill, but Bee is convinced the Ruffles are haunted. 10/10 &amp; 11/10 respectively https://t.co/fgORpmTN9C",,,"https://twitter.com/dog_rates/status/677314812125323265/photo/1,https://twitter.com/dog_rates/status/677314812125323265/photo/1",10,10,Tassy,,,,,,1,Blenheim_spaniel,470,1497
6.77301E+17,,,12/17/2015 1:35,Twitter for iPhone,This is Juckson. He's totally on his way to a nascar race. 5/10 for Juckson https://t.co/IoLRvF0Kak,,,https://twitter.com/dog_rates/status/677301033169788928/photo/1,5,10,Juckson,,,,,,0.5,Japanese_spaniel,354,1111
