tweet_id,in_reply_to_status_id,in_reply_to_user_id,timestamp,source,text,retweeted_status_id,retweeted_status_user_id,expanded_urls,rating_numerator,rating_denominator,name,doggo,floofer,pupper,puppo,stage,calculated_rating,most_likely_breed,retweet_count,favorite_count
7.96485E+17,,,11/9/2016 22:49,Twitter for iPhone,Here's a sleepy doggo that requested some assistance. 12/10 would carry everywhere https://t.co/bvkkqOjNDV,,,https://twitter.com/dog_rates/status/796484825502875648/photo/1,12,10,,doggo,,,,doggo,1.2,cocker_spaniel,1647,7169
7.96387E+17,,,11/9/2016 16:22,Twitter for iPhone,This is Snicku. He's having trouble reading because he's a dog. Glasses only helped a little. Nap preferred. 12/10 would snug well https://t.co/cVLUasbKA5,,,"https://twitter.com/dog_rates/status/796387464403357696/photo/1,https://twitter.com/dog_rates/status/796387464403357696/photo/1",12,10,Snicku,,,,,,1.2,Pekinese,3880,10440
7.9615E+17,,,11/9/2016 0:37,Twitter for iPhone,This is Ruby. She just turned on the news. Officially terrified. 11/10 deep breaths Ruby https://t.co/y5KarNXWXt,,,"https://twitter.com/dog_rates/status/796149749086875649/photo/1,https://twitter.com/dog_rates/status/796149749086875649/photo/1",11,10,Ruby,,,,,,1.1,golden_retriever,13328,30438
7.96116E+17,,,11/8/2016 22:25,Twitter for iPhone,I didn't believe it at first but now I can see that voter fraud is a serious h*ckin issue. 11/10 https://t.co/7i0bDMbrVN,,,https://twitter.com/dog_rates/status/796116448414461957/photo/1,11,10,,,,,,,1.1,Cardigan,2244,8617
7.9608E+17,,,11/8/2016 20:00,Twitter for iPhone,This is Yogi. He's 98% floof. Snuggable af. 12/10 https://t.co/opoXKxmfFm,,,https://twitter.com/dog_rates/status/796080075804475393/photo/1,12,10,Yogi,,,,,,1.2,chow,2158,8005
7.96031E+17,,,11/8/2016 16:47,Twitter for iPhone,This is Daisy. She's here to make your day better. 13/10 mission h*ckin successful https://t.co/PbgvuD0qIL,,,https://twitter.com/dog_rates/status/796031486298386433/photo/1,13,10,Daisy,,,,,,1.3,golden_retriever,3494,10245
7.95464E+17,,,11/7/2016 3:14,Twitter for iPhone,Elder doggo does a splash. Both 13/10 incredible stuff https://t.co/gBUDjdEcqz,,,https://twitter.com/dog_rates/status/795464331001561088/video/1,13,10,,doggo,,,,doggo,1.3,golden_retriever,21898,46656
7.954E+17,,,11/6/2016 22:59,Twitter for iPhone,This is Brody. He's trying to make the same face as the football. 12/10 https://t.co/2H4MfOGlpQ,,,"https://twitter.com/dog_rates/status/795400264262053889/photo/1,https://twitter.com/dog_rates/status/795400264262053889/photo/1,https://twitter.com/dog_rates/status/795400264262053889/photo/1,https://twitter.com/dog_rates/status/795400264262053889/photo/1",12,10,Brody,,,,,,1.2,golden_retriever,2677,9484
7.95077E+17,,,11/6/2016 1:33,Twitter for iPhone,This is Bailey. She loves going down slides but is very bad at it. Still 11/10 https://t.co/ivPWhspN3E,,,"https://twitter.com/dog_rates/status/795076730285391872/photo/1,https://twitter.com/dog_rates/status/795076730285391872/photo/1,https://twitter.com/dog_rates/status/795076730285391872/photo/1",11,10,Bailey,,,,,,1.1,,5081,15314
7.94927E+17,,,11/5/2016 15:37,Twitter for iPhone,This is Mack. He's rather h*ckin sleepy. Exceptional ears. 12/10 would boop https://t.co/XRPvTPF0VH,,,https://twitter.com/dog_rates/status/794926597468000259/photo/1,12,10,Mack,,,,,,1.2,toy_poodle,2153,9657
7.94332E+17,,,11/4/2016 0:15,Twitter for iPhone,This is Nimbus (like the cloud). He just bought this fancy af duck raincoat. Only protects one ear tho. 12/10 so h*ckin floofy https://t.co/SIQbb8c3AU,,,https://twitter.com/dog_rates/status/794332329137291264/photo/1,12,10,Nimbus,,,,,,1.2,Samoyed,2533,9110
7.94205E+17,,,11/3/2016 15:51,Twitter for iPhone,This is Laika. She was a space pupper. The first space pupper actually. Orbited earth like a h*ckin boss. 14/10 hero af https://t.co/trSjgY3h4g,,,"https://twitter.com/dog_rates/status/794205286408003585/photo/1,https://twitter.com/dog_rates/status/794205286408003585/photo/1,https://twitter.com/dog_rates/status/794205286408003585/photo/1",14,10,Laika,,,pupper,,pupper,1.4,,3105,8755
7.93962E+17,,,11/2/2016 23:45,Twitter for iPhone,This is Maximus. His face is stuck like that. Tragic really. Great tongue tho. 12/10 would pet firmly https://t.co/xIfrsMNLBR,,,"https://twitter.com/dog_rates/status/793962221541933056/photo/1,https://twitter.com/dog_rates/status/793962221541933056/photo/1",12,10,Maximus,,,,,,1.2,Labrador_retriever,4557,15878
7.93845E+17,,,11/2/2016 16:00,Twitter for iPhone,This is Clark. He was just caught wearing pants. 13/10 game-changing af https://t.co/2Xo19aPrG5,,,https://twitter.com/dog_rates/status/793845145112371200/photo/1,13,10,Clark,,,,,,1.3,Old_English_sheepdog,1740,8750
7.93602E+17,,,11/1/2016 23:53,Twitter for iPhone,This is Dobby. I can't stop looking at her feet. 12/10 would absolutely snug https://t.co/LhzPWv6rTv,,,https://twitter.com/dog_rates/status/793601777308463104/photo/1,12,10,Dobby,,,,,,1.2,miniature_pinscher,1512,7563
7.93501E+17,,,11/1/2016 17:12,Twitter for iPhone,This is Fiona. She's an extremely mediocre copilot. Very distracting. Wink makes up for all the missed turns. 12/10 https://t.co/aF5MmpvPqN,,,"https://twitter.com/dog_rates/status/793500921481273345/photo/1,https://twitter.com/dog_rates/status/793500921481273345/photo/1",12,10,Fiona,,,,,,1.2,golden_retriever,2226,10096
7.93286E+17,,,11/1/2016 3:00,Twitter for iPhone,This is Moreton. He's the Good Boy Who Lived. 13/10 magical as h*ck https://t.co/rLHGx3VAF3,,,"https://twitter.com/dog_rates/status/793286476301799424/photo/1,https://twitter.com/dog_rates/status/793286476301799424/photo/1",13,10,Moreton,,,,,,1.3,Afghan_hound,8576,23291
7.93271E+17,,,11/1/2016 2:00,Twitter for iPhone,Meet Dave. It's his favorite day of the year. He gets to fulfill his dream of being a dinosaur. 12/10 inspirational af https://t.co/MgQSdfZGPN,,,https://twitter.com/dog_rates/status/793271401113350145/photo/1,12,10,Dave,,,,,,1.2,Siberian_husky,2239,8236
7.93256E+17,,,11/1/2016 1:00,Twitter for iPhone,Oh h*ck look at this spookling right here. Fright level off the charts. 12/10 sufficiently spooked https://t.co/BNy9IIJMb0,,,https://twitter.com/dog_rates/status/793256262322548741/photo/1,12,10,,,,,,,1.2,basset,7776,18887
7.93241E+17,,,11/1/2016 0:00,Twitter for iPhone,This is Tucker. He's out here bustin h*ckin ghosts. 13/10 dedicated af https://t.co/Ap477GhwXt,,,https://twitter.com/dog_rates/status/793241302385262592/photo/1,13,10,Tucker,,,,,,1.3,golden_retriever,3065,9965
7.93226E+17,,,10/31/2016 23:00,Twitter for iPhone,"This is Juno. She spooked me up real good, but only to get my attention. Above average handwriting for a dog I think. 11/10 https://t.co/hFxxBCWlwj",,,"https://twitter.com/dog_rates/status/793226087023144960/photo/1,https://twitter.com/dog_rates/status/793226087023144960/photo/1,https://twitter.com/dog_rates/status/793226087023144960/photo/1",11,10,Juno,,,,,,1.1,wire-haired_fox_terrier,2708,9268
7.93211E+17,,,10/31/2016 22:00,Twitter for iPhone,This is Maude. She's the h*ckin happiest wasp you've ever seen. 10/10 would pet with caution https://t.co/etL8FHBrh8,,,https://twitter.com/dog_rates/status/793210959003287553/photo/1,10,10,Maude,,,,,,1,French_bulldog,2600,8463
7.93196E+17,,,10/31/2016 21:00,Twitter for iPhone,Say hello to Lily. She's pupset that her costume doesn't fit as well as last year. 12/10 poor puppo https://t.co/YSi6K1firY,,,"https://twitter.com/dog_rates/status/793195938047070209/photo/1,https://twitter.com/dog_rates/status/793195938047070209/photo/1",12,10,Lily,,,,puppo,puppo,1.2,Labrador_retriever,5258,14416
7.93181E+17,,,10/31/2016 20:00,Twitter for iPhone,This is Newt. He's a strawberry. 11/10 https://t.co/2VhmlwxA1Q,,,https://twitter.com/dog_rates/status/793180763617361921/photo/1,11,10,Newt,,,,,,1.1,Lakeland_terrier,1859,6547
7.93166E+17,,,10/31/2016 19:00,Twitter for iPhone,This is Benji. He's Air Bud. It's a low effort costume but he pulls it off rather h*ckin well. 12/10 would happily get dunked on https://t.co/IbzT7DJvBo,,,https://twitter.com/dog_rates/status/793165685325201412/photo/1,12,10,Benji,,,,,,1.2,golden_retriever,2621,8878
7.93151E+17,,,10/31/2016 18:00,Twitter for iPhone,This is Nida. She's a free elf. Waited so long for this day. 11/10 https://t.co/3lE8Izgmkf,,,https://twitter.com/dog_rates/status/793150605191548928/photo/1,11,10,Nida,,,,,,1.1,Italian_greyhound,1592,5836
7.93135E+17,,,10/31/2016 17:00,Twitter for iPhone,Your favorite squad is looking extra h*ckin spooky today. 13/10 for all https://t.co/PrgvOyPtDT,,,"https://twitter.com/dog_rates/status/793135492858580992/photo/1,https://twitter.com/dog_rates/status/793135492858580992/photo/1",13,10,,,,,,,1.3,,2348,6064
7.9312E+17,,,10/31/2016 16:00,Twitter for iPhone,"This is Robin. She's desperately trying to do me a frighten, but her tongue drastically decreases her spook value. Still 11/10 great effort https://t.co/sxMrsOZ8zb",,,https://twitter.com/dog_rates/status/793120401413079041/photo/1,11,10,Robin,,,,,,1.1,Labrador_retriever,3672,11992
7.92913E+17,,,10/31/2016 2:17,Twitter for iPhone,Here is a perfect example of someone who has their priorities in order. 13/10 for both owner and Forrest https://t.co/LRyMrU7Wfq,,,"https://twitter.com/dog_rates/status/792913359805018113/photo/1,https://twitter.com/dog_rates/status/792913359805018113/photo/1,https://twitter.com/dog_rates/status/792913359805018113/photo/1,https://twitter.com/dog_rates/status/792913359805018113/photo/1",13,10,,,,,,,1.3,,3703,13553
7.92884E+17,,,10/31/2016 0:20,Twitter for iPhone,This is Bailey. She's rather h*ckin hype for Halloween tomorrow. Carved those pupkins herself. 12/10 https://t.co/v17mFm0Ftz,,,"https://twitter.com/dog_rates/status/792883833364439040/photo/1,https://twitter.com/dog_rates/status/792883833364439040/photo/1,https://twitter.com/dog_rates/status/792883833364439040/photo/1,https://twitter.com/dog_rates/status/792883833364439040/photo/1",12,10,Bailey,,,,,,1.2,standard_poodle,3992,10690
7.92774E+17,,,10/30/2016 17:02,Twitter for iPhone,This is Monster. Not an actual monster tho. He's showing you his tongue. Very impressive Monster. 12/10 would snug https://t.co/RhaPExuxJL,,,https://twitter.com/dog_rates/status/792773781206999040/photo/1,12,10,Monster,,,,,,1.2,Yorkshire_terrier,1569,6986
7.92395E+17,,,10/29/2016 15:55,Twitter for iPhone,Meet BeBe. She rocks the messy bun of your dreams. H*ckin flawless. 12/10 would watch her tutorial https://t.co/of0pFNBIl8,,,"https://twitter.com/dog_rates/status/792394556390137856/photo/1,https://twitter.com/dog_rates/status/792394556390137856/photo/1",12,10,BeBe,,,,,,1.2,cocker_spaniel,4007,12688
7.9205E+17,,,10/28/2016 17:07,Twitter for iPhone,This is Remus. He's a mop that came to life. Can't see anything. Constantly trips over himself. Still a very good dog. 11/10 https://t.co/S3f1SYylzu,,,"https://twitter.com/dog_rates/status/792050063153438720/photo/1,https://twitter.com/dog_rates/status/792050063153438720/photo/1",11,10,Remus,,,,,,1.1,komondor,1667,6758
7.91672E+17,,,10/27/2016 16:06,Twitter for iPhone,When she says you're a good boy and you know you're a good boy because you're a good boy. 13/10 https://t.co/O5IUmRHRIh,,,https://twitter.com/dog_rates/status/791672322847637504/photo/1,13,10,,,,,,,1.3,golden_retriever,2919,11119
7.91407E+17,,,10/26/2016 22:31,Twitter for iPhone,Say hello to Levi. He's a Madagascan Butterbop. One of the more docile Butterbops I've seen. 12/10 would give all the pets https://t.co/Zcw9Sccctc,,,"https://twitter.com/dog_rates/status/791406955684368384/photo/1,https://twitter.com/dog_rates/status/791406955684368384/photo/1,https://twitter.com/dog_rates/status/791406955684368384/photo/1,https://twitter.com/dog_rates/status/791406955684368384/photo/1",12,10,Levi,,,,,,1.2,Pembroke,3846,12468
7.91312E+17,,,10/26/2016 16:14,Twitter for iPhone,This is Mabel. She's super h*ckin smol. Portable af. Comes with the smol shoe. 12/10 would keep in frocket https://t.co/GGJvxYt3xK,,,"https://twitter.com/dog_rates/status/791312159183634433/photo/1,https://twitter.com/dog_rates/status/791312159183634433/photo/1,https://twitter.com/dog_rates/status/791312159183634433/photo/1,https://twitter.com/dog_rates/status/791312159183634433/photo/1",12,10,Mabel,,,,,,1.2,miniature_pinscher,2359,8304
7.90987E+17,,,10/25/2016 18:44,Twitter for iPhone,This is Misty. She has a cowboy hat on her nose. 12/10 https://t.co/Eno0mypHIr,,,https://twitter.com/dog_rates/status/790987426131050500/photo/1,12,10,Misty,,,,,,1.2,cocker_spaniel,1981,9284
7.90946E+17,,,10/25/2016 16:00,Twitter for iPhone,This is Betty. She's assisting with the dishes. Such a good puppo. 12/10 h*ckin helpful af https://t.co/dgvTPZ9tgI,,,https://twitter.com/dog_rates/status/790946055508652032/photo/1,12,10,Betty,,,,puppo,puppo,1.2,golden_retriever,4375,15835
7.90699E+17,,,10/24/2016 23:37,Twitter for iPhone,This is Mosby. He appears to be rather h*ckin snuggable af. 12/10 keep it up Mosby https://t.co/IiiBq460I7,,,https://twitter.com/dog_rates/status/790698755171364864/photo/1,12,10,Mosby,,,,,,1.2,Bernese_mountain_dog,1798,7788
7.90582E+17,,,10/24/2016 15:53,Twitter for iPhone,This is Duke. He sneaks into the fridge sometimes. It's his safe place. 11/10 would give little jacket if necessary https://t.co/Fd5WFDTMH4,,,"https://twitter.com/dog_rates/status/790581949425475584/photo/1,https://twitter.com/dog_rates/status/790581949425475584/photo/1",11,10,Duke,,,,,,1.1,malinois,6624,19508
7.90338E+17,,,10/23/2016 23:42,Twitter for iPhone,Meet Maggie. She can hear your cells divide. 12/10 can also probably fly https://t.co/ovE2hqXryV,,,https://twitter.com/dog_rates/status/790337589677002753/photo/1,12,10,Maggie,,,,,,1.2,Pembroke,1763,7412
7.90277E+17,,,10/23/2016 19:42,Twitter for iPhone,This is Bruce. He never backs down from a challenge. 11/10 you got this Bruce https://t.co/aI7umZHIq7,,,https://twitter.com/dog_rates/status/790277117346975746/photo/1,11,10,Bruce,,,,,,1.1,Labrador_retriever,2946,11876
7.89986E+17,,,10/23/2016 0:27,Twitter for iPhone,This is Happy. He's a bathtub reviewer. Seems to be pleased with this one. 12/10 https://t.co/Ln89R4FP7v,,,https://twitter.com/dog_rates/status/789986466051088384/photo/1,12,10,Happy,,,,,,1.2,golden_retriever,2140,8789
7.89629E+17,,,10/22/2016 0:45,Twitter for iPhone,This is Eli. He can fly. 13/10 magical af https://t.co/huPSJJ7FDI,,,https://twitter.com/dog_rates/status/789628658055020548/photo/1,13,10,Eli,,,,,,1.3,chow,1639,7064
7.89599E+17,,,10/21/2016 22:48,Twitter for iPhone,This is Brownie. She's wearing a Halloween themed onesie. 12/10 festive af https://t.co/0R4meWXFOx,,,"https://twitter.com/dog_rates/status/789599242079838210/photo/1,https://twitter.com/dog_rates/status/789599242079838210/photo/1",12,10,Brownie,,,,,,1.2,Chesapeake_Bay_retriever,1788,6368
7.89531E+17,,,10/21/2016 18:16,Twitter for iPhone,This is Rizzy. She smiles a lot. 12/10 contagious af https://t.co/TU4sZogVIq,,,"https://twitter.com/dog_rates/status/789530877013393408/photo/1,https://twitter.com/dog_rates/status/789530877013393408/photo/1,https://twitter.com/dog_rates/status/789530877013393408/photo/1",12,10,Rizzy,,,,,,1.2,schipperke,3150,11065
7.89268E+17,,,10/21/2016 0:53,Twitter for iPhone,This is Stella. She's happier than I will ever be. 10/10 would trade lives with https://t.co/JSs2bfDtTS,,,https://twitter.com/dog_rates/status/789268448748703744/photo/1,10,10,Stella,,,,,,1,malamute,2437,8632
7.89138E+17,,,10/20/2016 16:15,Twitter for iPhone,This is Bo. He's a West Congolese Bugaboop Snuggle. Rather exotic. Master of the head tilt. 12/10 would pay to pet https://t.co/2jwxxtNzoN,,,"https://twitter.com/dog_rates/status/789137962068021249/photo/1,https://twitter.com/dog_rates/status/789137962068021249/photo/1,https://twitter.com/dog_rates/status/789137962068021249/photo/1",12,10,Bo,,,,,,1.2,Chihuahua,2601,9207
7.88908E+17,,,10/20/2016 1:03,Twitter for iPhone,"This is Lucy. She destroyed not one, but two remotes trying to turn off the debate. 11/10 relatable af https://t.co/3BXh073tDm",,,https://twitter.com/dog_rates/status/788908386943430656/photo/1,11,10,Lucy,,,,,,1.1,golden_retriever,11677,26013
7.88766E+17,,,10/19/2016 15:37,Twitter for iPhone,This is Butter. She can have whatever she wants forever. 12/10 would hug softly https://t.co/x5gXRS1abq,,,https://twitter.com/dog_rates/status/788765914992902144/photo/1,12,10,Butter,,,,,,1.2,cocker_spaniel,9634,25845
7.88412E+17,,,10/18/2016 16:11,Twitter for iPhone,This is Dexter. He breaks hearts for a living. 11/10 h*ckin handsome af https://t.co/4DhSsC1W7S,,,"https://twitter.com/dog_rates/status/788412144018661376/photo/1,https://twitter.com/dog_rates/status/788412144018661376/photo/1",11,10,Dexter,,,,,,1.1,golden_retriever,4909,14684
7.88178E+17,,,10/18/2016 0:41,Twitter for iPhone,Atlas is back and this time he's got doggles. Still 13/10 solarly conscious af https://t.co/s7MgFWDySc,,,"https://twitter.com/dog_rates/status/788178268662984705/photo/1,https://twitter.com/dog_rates/status/788178268662984705/photo/1,https://twitter.com/dog_rates/status/788178268662984705/photo/1,https://twitter.com/dog_rates/status/788178268662984705/photo/1",13,10,,,,,,,1.3,Samoyed,1967,6880
7.88151E+17,,,10/17/2016 22:51,Twitter for iPhone,This is Leo. He's a golden chow. Rather h*ckin rare. 13/10 would give extra pats https://t.co/xosHjFzVXc,,,"https://twitter.com/dog_rates/status/788150585577050112/photo/1,https://twitter.com/dog_rates/status/788150585577050112/photo/1,https://twitter.com/dog_rates/status/788150585577050112/photo/1,https://twitter.com/dog_rates/status/788150585577050112/photo/1",13,10,Leo,,,,,,1.3,chow,1196,5782
7.8804E+17,,,10/17/2016 15:31,Twitter for iPhone,Did... did they pick out that license plate? 12/10 for both https://t.co/lRmUUOxgbQ,,,"https://twitter.com/dog_rates/status/788039637453406209/photo/1,https://twitter.com/dog_rates/status/788039637453406209/photo/1",12,10,,,,,,,1.2,,1221,5780
7.87811E+17,,,10/17/2016 0:20,Twitter for iPhone,This is Frank. He wears sunglasses and walks himself. 11/10 I'll never be this cool or independent https://t.co/pNNjBtHWPc,,,"https://twitter.com/dog_rates/status/787810552592695296/photo/1,https://twitter.com/dog_rates/status/787810552592695296/photo/1",11,10,Frank,,,,,,1.1,pug,2832,8134
7.87718E+17,,,10/16/2016 18:11,Twitter for iPhone,This is Tonks. She is a service puppo. Can hear a caterpillar hiccup from 7 miles away. 13/10 would follow anywhere https://t.co/i622ZbWkUp,,,"https://twitter.com/dog_rates/status/787717603741622272/photo/1,https://twitter.com/dog_rates/status/787717603741622272/photo/1,https://twitter.com/dog_rates/status/787717603741622272/photo/1,https://twitter.com/dog_rates/status/787717603741622272/photo/1",13,10,Tonks,,,,puppo,puppo,1.3,German_shepherd,2579,9694
7.87398E+17,,,10/15/2016 21:01,Twitter for iPhone,This is Moose. He's rather h*ckin dangerous (you can tell by the collar). 11/10 would still attempt to snug https://t.co/lHVHGdDzb3,,,https://twitter.com/dog_rates/status/787397959788929025/photo/1,11,10,Moose,,,,,,1.1,Chihuahua,2658,10312
7.87322E+17,,,10/15/2016 16:01,Twitter for iPhone,This is Lincoln. He forgot to use his blinker when he changed lanes just now. Guilty as h*ck. Still 10/10 https://t.co/lsrR83SiVp,,,https://twitter.com/dog_rates/status/787322443945877504/photo/1,10,10,Lincoln,,,,,,1,golden_retriever,1621,7376
7.86963E+17,,,10/14/2016 16:13,Twitter for iPhone,This is Rory. He's got an interview in a few minutes. Looking spiffy af. Nervous as h*ck tho. 12/10 would hire https://t.co/ibj5g6xaAj,,,https://twitter.com/dog_rates/status/786963064373534720/photo/1,12,10,Rory,,,,,,1.2,golden_retriever,7407,25226
7.86709E+17,,,10/13/2016 23:23,Twitter for iPhone,"This is Logan, the Chow who lived. He solemnly swears he's up to lots of good. H*ckin magical af 9.75/10 https://t.co/yBO5wuqaPS",,,https://twitter.com/dog_rates/status/786709082849828864/photo/1,75,10,Logan,,,,,,7.5,Pomeranian,5714,17333
7.86665E+17,,,10/13/2016 20:28,Twitter for iPhone,"""Honestly Kathleen I just want more Ken Bone"" 12/10 https://t.co/HmlEvAMP4r",,,https://twitter.com/dog_rates/status/786664955043049472/photo/1,12,10,,,,,,,1.2,Leonberg,2359,10030
7.86596E+17,,,10/13/2016 15:54,Twitter for iPhone,This is Dale. He's a real spookster. Did me quite the frighten. 11/10 not too spooky to pet tho https://t.co/L8BWDD4oBX,,,https://twitter.com/dog_rates/status/786595970293370880/photo/1,11,10,Dale,,,,,,1.1,Pembroke,2905,8958
7.86363E+17,,,10/13/2016 0:29,Twitter for iPhone,This is Rizzo. He has many talents. A true renaissance doggo. 13/10 entertaining af https://t.co/TVXpEJB7Wn,,,"https://twitter.com/dog_rates/status/786363235746385920/photo/1,https://twitter.com/dog_rates/status/786363235746385920/photo/1,https://twitter.com/dog_rates/status/786363235746385920/photo/1,https://twitter.com/dog_rates/status/786363235746385920/photo/1",13,10,Rizzo,doggo,,,,doggo,1.3,golden_retriever,3207,10256
7.86234E+17,,,10/12/2016 15:55,Twitter for iPhone,This is Mattie. She's extremely dangerous. Will bite your h*ckin finger right off. Still 11/10 would pet with caution https://t.co/78c9W8kLFh,,,https://twitter.com/dog_rates/status/786233965241827333/photo/1,11,10,Mattie,,,,,,1.1,Labrador_retriever,4360,14372
7.85928E+17,,,10/11/2016 19:39,Twitter for iPhone,This is Lucy. She's strives to be the best potato she can be. 12/10 would boop https://t.co/lntsj7Fc4Y,,,https://twitter.com/dog_rates/status/785927819176054784/photo/1,12,10,Lucy,,,,,,1.2,toy_poodle,2974,10779
7.85873E+17,,,10/11/2016 16:00,Twitter for iPhone,Meet Rusty. He appears to be rather h*ckin fluffy. Also downright adorable af. 12/10 would rub my face against his https://t.co/1j9kLGb4wV,,,https://twitter.com/dog_rates/status/785872687017132033/video/1,12,10,Rusty,,,,,,1.2,Great_Pyrenees,1667,6325
7.8564E+17,,,10/11/2016 0:34,Twitter for iPhone,This is Pinot. He's a sophisticated doggo. You can tell by the hat. Also pointier than your average pupper. Still 10/10 would pet cautiously https://t.co/f2wmLZTPHd,,,"https://twitter.com/dog_rates/status/785639753186217984/photo/1,https://twitter.com/dog_rates/status/785639753186217984/photo/1",10,10,Pinot,doggo,,pupper,,,1,,2100,7440
7.85533E+17,,,10/10/2016 17:32,Twitter for iPhone,This is Dallas. Her tongue is ridiculous. 11/10 h*ckin proud af https://t.co/h4jhlH4EyG,,,"https://twitter.com/dog_rates/status/785533386513321988/photo/1,https://twitter.com/dog_rates/status/785533386513321988/photo/1",11,10,Dallas,,,,,,1.1,miniature_pinscher,1832,8562
7.85265E+17,,,10/9/2016 23:44,Twitter for iPhone,This is Doc. He requested to be carried around like that. 12/10 anything for Doc https://t.co/mWYACm4qnx,,,https://twitter.com/dog_rates/status/785264754247995392/photo/1,12,10,Doc,,,,,,1.2,chow,1513,6892
7.85171E+17,,,10/9/2016 17:31,Twitter for iPhone,This is Hero. He was enjoying the car ride until he remembered that bees are dying globally at an alarming rate. 11/10 https://t.co/cubFg7F4qQ,,,"https://twitter.com/dog_rates/status/785170936622350336/photo/1,https://twitter.com/dog_rates/status/785170936622350336/photo/1,https://twitter.com/dog_rates/status/785170936622350336/photo/1,https://twitter.com/dog_rates/status/785170936622350336/photo/1",11,10,Hero,,,,,,1.1,Eskimo_dog,4483,11335
7.84826E+17,,,10/8/2016 18:41,Twitter for iPhone,This is Rusty. He's going D1 for sure. Insane vertical. 13/10 would draft https://t.co/AsykOwMrXQ,,,https://twitter.com/dog_rates/status/784826020293709826/photo/1,13,10,Rusty,,,,,,1.3,chow,3000,9558
7.84518E+17,,,10/7/2016 22:15,Twitter for iPhone,This is Frankie. He has yet to learn how to control his tongue. 11/10 maybe one day https://t.co/p6fgYe2dB6,,,"https://twitter.com/dog_rates/status/784517518371221505/photo/1,https://twitter.com/dog_rates/status/784517518371221505/photo/1,https://twitter.com/dog_rates/status/784517518371221505/photo/1",11,10,Frankie,,,,,,1.1,malamute,2357,8473
7.84431E+17,,,10/7/2016 16:33,Twitter for iPhone,This is Stormy. He's curly af. Already pupared for Coachella next year. 12/10 https://t.co/PHA1vtqqpt,,,https://twitter.com/dog_rates/status/784431430411685888/photo/1,12,10,Stormy,,,,,,1.2,miniature_poodle,1181,5436
7.8384E+17,,,10/6/2016 1:23,Twitter for iPhone,This is Riley. His owner put a donut pillow around him and he loves it so much he won't let anyone take it off. 13/10 https://t.co/8TCQcsZCZ8,,,"https://twitter.com/dog_rates/status/783839966405230592/photo/1,https://twitter.com/dog_rates/status/783839966405230592/photo/1,https://twitter.com/dog_rates/status/783839966405230592/photo/1",13,10,Riley,,,,,,1.3,,10007,28321
7.83821E+17,,,10/6/2016 0:08,Twitter for iPhone,This is Mairi. She has mastered the art of camouflage. 12/10 h*ckin sneaky af https://t.co/STcPjiNAHp,,,"https://twitter.com/dog_rates/status/783821107061198850/photo/1,https://twitter.com/dog_rates/status/783821107061198850/photo/1",12,10,Mairi,,,,,,1.2,Lakeland_terrier,1822,6958
7.83695E+17,,,10/5/2016 15:47,Twitter for iPhone,This is Loomis. He's the leader of the Kenneth search party. The passion is almost overwhelming. 12/10 one day he will be free https://t.co/kCRKlFg4AY,,,"https://twitter.com/dog_rates/status/783695101801398276/photo/1,https://twitter.com/dog_rates/status/783695101801398276/photo/1,https://twitter.com/dog_rates/status/783695101801398276/photo/1",12,10,Loomis,,,,,,1.2,chow,2981,9839
7.83467E+17,,,10/5/2016 0:40,Twitter for iPhone,This is Finn. He likes eavesdropping from filing cabinets. It's a real issue but no one has approached him about it. 11/10 would still pet https://t.co/s8W8Del9HQ,,,"https://twitter.com/dog_rates/status/783466772167098368/photo/1,https://twitter.com/dog_rates/status/783466772167098368/photo/1",11,10,Finn,,,,,,1.1,Chihuahua,2073,7950
