tweet_id,in_reply_to_status_id,in_reply_to_user_id,timestamp,source,text,retweeted_status_id,retweeted_status_user_id,expanded_urls,rating_numerator,rating_denominator,name,doggo,floofer,pupper,puppo,stage,calculated_rating,most_likely_breed,retweet_count,favorite_count
7.15697E+17,,,4/1/2016 0:26,Twitter for iPhone,Meet Toby. He's a Lithuanian High-Steppin Stickeroo. One of the more accomplished Stickeroos around. 10/10 so nifty https://t.co/cYPHuJYTjC,,,https://twitter.com/dog_rates/status/715696743237730304/photo/1,10,10,Toby,,,,,,1,Staffordshire_bullterrier,1164,3610
7.15681E+17,,,3/31/2016 23:22,Twitter for iPhone,This is Zeus. He's downright fabulous. 12/10 https://t.co/sSugyyRuTp,,,"https://twitter.com/dog_rates/status/715680795826982913/photo/1,https://twitter.com/dog_rates/status/715680795826982913/photo/1,https://twitter.com/dog_rates/status/715680795826982913/photo/1",12,10,Zeus,,,,,,1.2,golden_retriever,1442,3965
7.1536E+17,,,3/31/2016 2:09,Twitter for iPhone,This is Bertson. He just wants to say hi. 11/10 would boop nose https://t.co/hwv7Wq6gDA,,,https://twitter.com/dog_rates/status/715360349751484417/photo/1,11,10,Bertson,,,,,,1.1,,1409,5031
7.15342E+17,,,3/31/2016 0:58,Twitter for iPhone,This is Oscar. He's a world renowned snowball inspector. It's a ruff job but someone has to do it. 10/10 great guy https://t.co/vSufMAKm3C,,,"https://twitter.com/dog_rates/status/715342466308784130/photo/1,https://twitter.com/dog_rates/status/715342466308784130/photo/1",10,10,Oscar,,,,,,1,West_Highland_white_terrier,622,2791
7.1522E+17,,,3/30/2016 16:52,Twitter for iPhone,This is Nico. His selfie game is strong af. Excellent use of a sneaky tongue slip. 10/10 star material https://t.co/1OBdJkMOFx,,,https://twitter.com/dog_rates/status/715220193576927233/photo/1,10,10,Nico,,,,,,1,Chihuahua,587,2209
7.15201E+17,,,3/30/2016 15:34,Twitter for iPhone,This is Michelangelope. He's half coffee cup. Rare af. 12/10 would hug until someone stopped me https://t.co/tvVDY0G911,,,https://twitter.com/dog_rates/status/715200624753819648/photo/1,12,10,Michelangelope,,,,,,1.2,Chihuahua,1682,4745
7.1501E+17,,,3/30/2016 2:56,Twitter for iPhone,This is Siba. She's remarkably mobile. Very sleepy as well. 12/10 would happily transport https://t.co/TjnI33RE1i,,,https://twitter.com/dog_rates/status/715009755312439296/photo/1,12,10,Siba,,,,,,1.2,Chihuahua,1104,3814
7.14982E+17,,,3/30/2016 1:07,Twitter for iPhone,This is Calbert. He forgot to clear his Google search history. 9/10 rookie mistake Calbert https://t.co/jRm5J3YCmj,,,https://twitter.com/dog_rates/status/714982300363173890/photo/1,9,10,Calbert,,,,,,0.9,Brittany_spaniel,931,3425
7.14958E+17,,,3/29/2016 23:29,Twitter for iPhone,This is Curtis. He's an Albino Haberdasher. Terrified of dandelions. They really spook him up. 10/10 it'll be ok pup https://t.co/s8YcfZrWhK,,,https://twitter.com/dog_rates/status/714957620017307648/photo/1,10,10,Curtis,,,,,,1,Great_Pyrenees,1277,3809
7.14632E+17,,,3/29/2016 1:53,Twitter for iPhone,This is Benedict. He's a feisty pup. Needs a brushing. Portable af. Looks very angry actually. 4/10 might not pet https://t.co/3oeFfHjv0Z,,,https://twitter.com/dog_rates/status/714631576617938945/photo/1,4,10,Benedict,,,,,,0.4,,897,3013
7.14606E+17,,,3/29/2016 0:12,Twitter for iPhone,Here are two lil cuddly puppers. Both 12/10 would snug like so much https://t.co/zO4eb7C4tG,,,https://twitter.com/dog_rates/status/714606013974974464/photo/1,12,10,,,,,,,1.2,Norfolk_terrier,829,3340
7.14258E+17,,,3/28/2016 1:10,Twitter for iPhone,"Meet Travis and Flurp. Travis is pretty chill but Flurp can't lie down properly. 10/10 &amp; 8/10
get it together Flurp https://t.co/Akzl5ynMmE",,,https://twitter.com/dog_rates/status/714258258790387713/photo/1,10,10,Travis,,,,,,1,collie,667,2816
7.14252E+17,,,3/28/2016 0:43,Twitter for iPhone,This is Thumas. He hates potted plants. 8/10 wtf Thumas https://t.co/rDVueNIcEi,,,"https://twitter.com/dog_rates/status/714251586676113411/photo/1,https://twitter.com/dog_rates/status/714251586676113411/photo/1",8,10,Thumas,,,,,,0.8,soft-coated_wheaten_terrier,758,3023
7.14214E+17,,,3/27/2016 22:14,Twitter for iPhone,Happy Easter from the squad! ðŸ‡ðŸ¶ 13/10 for all https://t.co/YMx4KWJUAB,,,https://twitter.com/dog_rates/status/714214115368108032/photo/1,13,10,,,,,,,1.3,pug,797,2111
7.14141E+17,,,3/27/2016 17:25,Twitter for iPhone,"I know we only rate dogs, but since it's Easter I guess we could rate a bunny for a change. 10/10 petable as hell https://t.co/O2RlKXigHu",,,https://twitter.com/dog_rates/status/714141408463036416/photo/1,10,10,,,,,,,1,Labrador_retriever,1278,4002
7.13919E+17,,,3/27/2016 2:43,Twitter for iPhone,This is Kanu. He's a Freckled Ticonderoga. Simply flawless. 12/10 would perform an elaborate heist to capture https://t.co/7vyAzIURrE,,,https://twitter.com/dog_rates/status/713919462244790272/photo/1,12,10,Kanu,,,,,,1.2,Siberian_husky,720,3040
7.13901E+17,,,3/27/2016 1:29,Twitter for iPhone,Happy Saturday here's 9 puppers on a bench. 99/90 good work everybody https://t.co/mpvaVxKmc1,,,https://twitter.com/dog_rates/status/713900603437621249/photo/1,99,90,,,,,,,1.1,golden_retriever,661,2616
7.13761E+17,,,3/26/2016 16:15,Twitter for iPhone,This is Piper. She would really like that tennis ball core. Super sneaky tongue slip. 12/10 precious af https://t.co/QP6GHi5az9,,,"https://twitter.com/dog_rates/status/713761197720473600/photo/1,https://twitter.com/dog_rates/status/713761197720473600/photo/1",12,10,Piper,,,,,,1.2,Brittany_spaniel,1239,4458
7.13411E+17,,,3/25/2016 17:03,Twitter for iPhone,Here we see an extremely rare Bearded Floofmallow. Only a few left in the wild. 11/10 would pet with a purpose https://t.co/jVJJKlPbvq,,,https://twitter.com/dog_rates/status/713411074226274305/photo/1,11,10,,,,,,,1.1,Great_Pyrenees,1184,4092
7.13178E+17,,,3/25/2016 1:35,Twitter for iPhone,This is Lance. Lance doesn't give a shit. 10/10 we should all be more like Lance https://t.co/SqnG9Ap28J,,,https://twitter.com/dog_rates/status/713177543487135744/photo/1,10,10,Lance,,,,,,1,whippet,2587,6643
7.13176E+17,,,3/25/2016 1:29,Twitter for iPhone,Say hello to Opie and Clarkus. Clarkus fell asleep so Opie buried him. Ruthless af 10/10 for both https://t.co/xT7XaY4gnW,,,https://twitter.com/dog_rates/status/713175907180089344/photo/1,10,10,Opie,,,,,,1,malamute,1330,4083
7.12809E+17,,,3/24/2016 1:11,Twitter for iPhone,This is Stubert. He just arrived. 10/10 https://t.co/HVGs5aAKAn,,,https://twitter.com/dog_rates/status/712809025985978368/photo/1,10,10,Stubert,,,,,,1,Labrador_retriever,6075,17533
7.12718E+17,,,3/23/2016 19:09,Twitter for iPhone,Please don't send in any more polar bears. We only rate dogs. Thank you... 10/10 https://t.co/83RGhdIQz2,,,https://twitter.com/dog_rates/status/712717840512598017/photo/1,10,10,,,,,,,1,Great_Pyrenees,4504,11304
7.12669E+17,,,3/23/2016 15:53,Twitter for iPhone,Say hello to Sunny and Roxy. They pull things out of water together. 10/10 for both https://t.co/88aedAmxcl,,,"https://twitter.com/dog_rates/status/712668654853337088/photo/1,https://twitter.com/dog_rates/status/712668654853337088/photo/1,https://twitter.com/dog_rates/status/712668654853337088/photo/1",10,10,Sunny,,,,,,1,Labrador_retriever,1097,3819
7.12438E+17,,,3/23/2016 0:37,Twitter for iPhone,This is Kane. He's a semi-submerged Haitian Huffleplop. Happy af. Sick waterfall. 11/10 would pat head approvingly https://t.co/7zjEC501Ul,,,https://twitter.com/dog_rates/status/712438159032893441/photo/1,11,10,Kane,,,,,,1.1,Great_Pyrenees,1416,4901
7.12097E+17,,,3/22/2016 2:03,Twitter for iPhone,I can't even comprehend how confused this dog must be right now. 10/10 https://t.co/8AGcQ4hIfK,,,https://twitter.com/dog_rates/status/712097430750289920/photo/1,10,10,,,,,,,1,Labrador_retriever,932,3451
7.12093E+17,,,3/22/2016 1:45,Twitter for iPhone,This is Steven. He's inverted af. Also very helpful. Scans anything you want for free. Takes him a while tho. 7/10 https://t.co/tA0ZiQ7JcG,,,https://twitter.com/dog_rates/status/712092745624633345/photo/1,7,10,Steven,,,,,,0.7,,812,2710
7.12086E+17,,,3/22/2016 1:16,Twitter for iPhone,"Say hello to Olive and Ruby. They are best buddies. Both 11/10 
1 like = 1 buddy https://t.co/yagmFdKlyL",,,"https://twitter.com/dog_rates/status/712085617388212225/photo/1,https://twitter.com/dog_rates/status/712085617388212225/photo/1,https://twitter.com/dog_rates/status/712085617388212225/photo/1",11,10,Olive,,,,,,1.1,Shih-Tzu,434,3014
7.12065E+17,,,3/21/2016 23:55,Twitter for iPhone,This is Chester. He's clearly in charge of the other dogs. Weird ass paws. Not fit for fetch. 6/10 would still pet https://t.co/o2GvskrhHt,,,https://twitter.com/dog_rates/status/712065007010385924/photo/1,6,10,Chester,,,,,,0.6,,568,2074
7.11968E+17,,,3/21/2016 17:30,Twitter for iPhone,Meet Winston. He's trapped in a cup of coffee. Poor pupper. 10/10 someone free him https://t.co/2e6cUtKUuc,,,https://twitter.com/dog_rates/status/711968124745228288/photo/1,10,10,Winston,,,pupper,,pupper,1,,2091,7407
7.11744E+17,,,3/21/2016 2:38,Twitter for iPhone,Meet Roosevelt. He's calculating the best case scenario if he drops out instead of doing math hw. 11/10 relatable af https://t.co/QcSIRDpfVg,,,https://twitter.com/dog_rates/status/711743778164514816/photo/1,11,10,Roosevelt,,,,,,1.1,Lakeland_terrier,906,2615
7.11733E+17,,,3/21/2016 1:54,Twitter for iPhone,I want to hear the joke this dog was just told. 10/10 https://t.co/1KiuZqqOD4,,,"https://twitter.com/dog_rates/status/711732680602345472/photo/1,https://twitter.com/dog_rates/status/711732680602345472/photo/1,https://twitter.com/dog_rates/status/711732680602345472/photo/1",10,10,,,,,,,1,Ibizan_hound,3690,8070
7.11695E+17,,,3/20/2016 23:23,Twitter for iPhone,Oh. My. God. 13/10 magical af https://t.co/Ezu6jQrKAZ,,,https://twitter.com/dog_rates/status/711694788429553666/photo/1,13,10,,,,,,,1.3,,16597,30235
7.11653E+17,,,3/20/2016 20:36,Twitter for iPhone,This is Gary. He just wanted to say hi. 9/10 very personable pup https://t.co/Sk3CbhmKSW,,,https://twitter.com/dog_rates/status/711652651650457602/photo/1,9,10,Gary,,,,,,0.9,,819,3546
7.11364E+17,,,3/20/2016 1:28,Twitter for iPhone,"""Please, no puparazzi"" 11/10 https://t.co/nJIXSPfedK",,,"https://twitter.com/dog_rates/status/711363825979756544/photo/1,https://twitter.com/dog_rates/status/711363825979756544/photo/1",11,10,,,,,,,1.1,Pembroke,1017,3323
7.11307E+17,,,3/19/2016 21:41,Twitter for iPhone,What hooligan sent in pictures w/out a dog in them? Churlish af. 3/10 just bc that's a neat fluffy bean bag chair https://t.co/wcwoGOkZvz,,,"https://twitter.com/dog_rates/status/711306686208872448/photo/1,https://twitter.com/dog_rates/status/711306686208872448/photo/1",3,10,,,,,,,0.3,Dandie_Dinmont,678,3047
7.11008E+17,,,3/19/2016 1:54,Twitter for iPhone,This is Chuckles. He had a balloon but he accidentally let go of it and it floated away. 11/10 hang in there pupper https://t.co/68iNM7B5gW,,,https://twitter.com/dog_rates/status/711008018775851008/photo/1,11,10,Chuckles,,,pupper,,pupper,1.1,French_bulldog,559,2742
7.10997E+17,,,3/19/2016 1:11,Twitter for iPhone,Meet Milo and Amos. They are the best of pals. Both 12/10 would pet at the same time https://t.co/Mv37BHEyyD,,,https://twitter.com/dog_rates/status/710997087345876993/photo/1,12,10,Milo,,,,,,1.2,malamute,1260,4213
7.10845E+17,,,3/18/2016 15:05,Twitter for iPhone,This is Staniel. His selfie game is strong af. 10/10 I'd snapchat with Staniel https://t.co/UgkTw7TKyM,,,https://twitter.com/dog_rates/status/710844581445812225/photo/1,10,10,Staniel,,,,,,1,Pembroke,610,2350
7.10833E+17,,,3/18/2016 14:19,Twitter for iPhone,Say hello to Sora. She's an Egyptian Pumpernickel. Mesmerizing af. 12/10 would bring home to mom https://t.co/PmTR4kxZkq,,,https://twitter.com/dog_rates/status/710833117892898816/photo/1,12,10,Sora,,,,,,1.2,Pembroke,476,2466
7.10659E+17,,,3/18/2016 2:46,Twitter for iPhone,Here's a brigade of puppers. All look very prepared for whatever happens next. 80/80 https://t.co/0eb7R1Om12,,,https://twitter.com/dog_rates/status/710658690886586372/photo/1,80,80,,,,,,,1,soft-coated_wheaten_terrier,512,2137
7.10589E+17,,,3/17/2016 22:09,Twitter for iPhone,This is Beemo. He's a Chubberflop mix. 12/10 would cross the world for https://t.co/kzMVMU8HBV,,,"https://twitter.com/dog_rates/status/710588934686908417/photo/1,https://twitter.com/dog_rates/status/710588934686908417/photo/1,https://twitter.com/dog_rates/status/710588934686908417/photo/1,https://twitter.com/dog_rates/status/710588934686908417/photo/1",12,10,Beemo,,,,,,1.2,Pembroke,1696,4172
7.10283E+17,,,3/17/2016 1:55,Twitter for iPhone,This is Gunner. He's a Figamus Newton. King of the peek-a-boo. Cool jeans. 11/10 https://t.co/ONuBILIYXZ,,,"https://twitter.com/dog_rates/status/710283270106132480/photo/1,https://twitter.com/dog_rates/status/710283270106132480/photo/1",11,10,Gunner,,,,,,1.1,Shih-Tzu,480,1995
7.10272E+17,,,3/17/2016 1:11,Twitter for iPhone,We ðŸ‘ðŸ» only ðŸ‘ðŸ» rate ðŸ‘ðŸ» dogs. Pls stop sending in non-canines like this Dutch Panda Worm. This is infuriating. 11/10 https://t.co/odfLzBonG2,,,https://twitter.com/dog_rates/status/710272297844797440/photo/1,11,10,infuriating,,,,,,1.1,Old_English_sheepdog,1139,4146
7.10269E+17,,,3/17/2016 0:58,Twitter for iPhone,"The squad is back for St. Patrick's Day! â˜˜ ðŸ’š
13/10 for all https://t.co/OcCDb2bng5",,,https://twitter.com/dog_rates/status/710269109699739648/photo/1,13,10,,,,,,,1.3,pug,1013,2195
7.10153E+17,,,3/16/2016 17:18,Twitter for iPhone,This is Lacy. She's tipping her hat to you. Daydreams of her life back on the frontier. 11/10 would pet so well https://t.co/fG5Pk3Et1I,,,"https://twitter.com/dog_rates/status/710153181850935296/photo/1,https://twitter.com/dog_rates/status/710153181850935296/photo/1",11,10,Lacy,,,,,,1.1,cocker_spaniel,808,2682
7.10141E+17,,,3/16/2016 16:29,Twitter for iPhone,This is Tater. His underbite is fierce af. Doesn't give a damn about your engagement photo. 8/10 https://t.co/nLuPY3pY12,,,https://twitter.com/dog_rates/status/710140971284037632/photo/1,8,10,Tater,,,,,,0.8,Pekinese,800,2515
7.10117E+17,,,3/16/2016 14:54,Twitter for iPhone,This pupper got her hair chalked for her birthday. Hasn't told her parents yet. Rebellious af. 11/10 very nifty https://t.co/h1OX2mLtxV,,,"https://twitter.com/dog_rates/status/710117014656950272/photo/1,https://twitter.com/dog_rates/status/710117014656950272/photo/1",11,10,,,,pupper,,pupper,1.1,toy_poodle,1780,5026
7.09919E+17,,,3/16/2016 1:46,Twitter for iPhone,Meet Watson. He's a Suzuki Tickleboop. Leader of a notorious biker gang. Only one ear functional. 12/10 snuggable af https://t.co/R1gLc5vDqG,,,"https://twitter.com/dog_rates/status/709918798883774466/photo/1,https://twitter.com/dog_rates/status/709918798883774466/photo/1",12,10,Watson,,,,,,1.2,Pembroke,993,3221
7.09901E+17,,,3/16/2016 0:37,Twitter for iPhone,"WeRateDogs stickers are here and they're 12/10! Use code ""puppers"" at checkout ðŸ¶ðŸ¾

Shop now: https://t.co/k5xsufRKYm https://t.co/ShXk46V13r",,,"http://goo.gl/ArWZfi,https://twitter.com/dog_rates/status/709901256215666688/photo/1,https://twitter.com/dog_rates/status/709901256215666688/photo/1,https://twitter.com/dog_rates/status/709901256215666688/photo/1,https://twitter.com/dog_rates/status/709901256215666688/photo/1",12,10,,,,,,,1.2,,92,609
7.09853E+17,,,3/15/2016 21:24,Twitter for iPhone,*lets out a tiny whimper and then collapses* ...12/10 https://t.co/BNdVZEHRow,,,"https://twitter.com/dog_rates/status/709852847387627521/photo/1,https://twitter.com/dog_rates/status/709852847387627521/photo/1,https://twitter.com/dog_rates/status/709852847387627521/photo/1,https://twitter.com/dog_rates/status/709852847387627521/photo/1",12,10,,,,,,,1.2,Chihuahua,1089,3234
7.09566E+17,,,3/15/2016 2:25,Twitter for iPhone,This is Olaf. He's gotta be rare. Seems sturdy. Tail is floofy af. 12/10 would do whatever it takes to pet https://t.co/E9jaU59bh9,,,https://twitter.com/dog_rates/status/709566166965075968/photo/1,12,10,Olaf,,,,,,1.2,chow,1072,3252
7.09557E+17,,,3/15/2016 1:48,Twitter for iPhone,This is Cecil. She's a Gigglefloof Poofer. Outdoorsy af. One with nature. 12/10 would strategically capture https://t.co/ijJB0DuOIC,,,"https://twitter.com/dog_rates/status/709556954897764353/photo/1,https://twitter.com/dog_rates/status/709556954897764353/photo/1,https://twitter.com/dog_rates/status/709556954897764353/photo/1",12,10,Cecil,,,,,,1.2,golden_retriever,974,3022
7.09519E+17,,,3/14/2016 23:19,Twitter for iPhone,This is Vince. He's a Gregorian Flapjeck. White spot on legs almost looks like another dog (whoa). 9/10 rad as hell https://t.co/aczGAV2dK4,,,https://twitter.com/dog_rates/status/709519240576036864/photo/1,9,10,Vince,,,,,,0.9,cocker_spaniel,219,1385
7.0945E+17,,,3/14/2016 18:42,Twitter for iPhone,Meet Karma. She's just a head. Lost body during the Second Punic War (unfortunate). Loves to travel 10/10 petable af https://t.co/c6af6nYEPo,,,"https://twitter.com/dog_rates/status/709449600415961088/photo/1,https://twitter.com/dog_rates/status/709449600415961088/photo/1",10,10,Karma,,,,,,1,Maltese_dog,517,2022
7.09409E+17,,,3/14/2016 16:02,Twitter for iPhone,This is Billy. He sensed a squirrel. 8/10 damn it Billy https://t.co/Yu0K98VZ9A,,,https://twitter.com/dog_rates/status/709409458133323776/photo/1,8,10,Billy,,,,,,0.8,Shetland_sheepdog,617,2424
7.09225E+17,,,3/14/2016 3:50,Twitter for iPhone,This is Walker. He's a Butternut Khalifa. Appears fuzzy af. 11/10 would hug for a ridiculous amount of time https://t.co/k6fEWHSALn,,,https://twitter.com/dog_rates/status/709225125749587968/photo/1,11,10,Walker,,,,,,1.1,Labrador_retriever,521,2204
7.09207E+17,,,3/14/2016 2:39,Twitter for iPhone,This is Penny. She's trying on her prom dress. Stunning af 11/10 https://t.co/qcZDZGCapg,,,https://twitter.com/dog_rates/status/709207347839836162/photo/1,11,10,Penny,,,,,,1.1,Chihuahua,5171,11409
7.09198E+17,,,3/14/2016 2:04,Twitter for iPhone,"From left to right:
Cletus, Jerome, Alejandro, Burp, &amp; Titson
None know where camera is. 45/50 would hug all at once https://t.co/sedre1ivTK",,,https://twitter.com/dog_rates/status/709198395643068416/photo/1,45,50,,,,,,,0.9,borzoi,589,2263
7.09158E+17,,,3/13/2016 23:24,Twitter for iPhone,Meet Rodney. He's a Ukranian Boomchicka. Outside but would like to be inside. Only has one ear (unfortunate) 10/10 https://t.co/FjAj3ggXrR,,,https://twitter.com/dog_rates/status/709158332880297985/photo/1,10,10,Rodney,,,,,,1,Siberian_husky,366,1874
7.09042E+17,,,3/13/2016 15:43,Twitter for iPhone,This is Klevin. He's addicted to sandwiches (yes a hotdog is a sandwich fight me) It's tearing his family apart 9/10 https://t.co/7BkkVNu5pd,,,https://twitter.com/dog_rates/status/709042156699303936/photo/1,9,10,Klevin,,,,,,0.9,Rottweiler,1477,4328
7.08846E+17,,,3/13/2016 2:43,Twitter for iPhone,Here's a pupper with magic eyes. Not wearing a seat belt tho (irresponsible af). Very distracting to driver. 9/10 https://t.co/5DLJB4ssvI,,,"https://twitter.com/dog_rates/status/708845821941387268/photo/1,https://twitter.com/dog_rates/status/708845821941387268/photo/1",9,10,,,,pupper,,pupper,0.9,schipperke,802,2738
7.08834E+17,,,3/13/2016 1:57,Twitter for iPhone,Meet Malikai. He was rolling around having fun when he remembered the inevitable heat death of the universe. 10/10 https://t.co/Vd2FqHIIGn,,,https://twitter.com/dog_rates/status/708834316713893888/photo/1,10,10,Malikai,,,,,,1,Eskimo_dog,449,1550
7.08811E+17,,,3/13/2016 0:24,Twitter for iPhone,This is Mister. He's a wonderful father to his two pups. Heartwarming af. 10/10 for all https://t.co/2KcuJXL2r4,,,"https://twitter.com/dog_rates/status/708810915978854401/photo/1,https://twitter.com/dog_rates/status/708810915978854401/photo/1,https://twitter.com/dog_rates/status/708810915978854401/photo/1",10,10,Mister,,,,,,1,golden_retriever,6246,15220
7.08738E+17,,,3/12/2016 19:35,Twitter for iPhone,This is Coco. She gets to stay on the Bachelor for another week. Super pumped 11/10 https://t.co/wsCB6LFNxD,,,https://twitter.com/dog_rates/status/708738143638450176/photo/1,11,10,Coco,,,,,,1.1,Pomeranian,739,2538
7.08711E+17,,,3/12/2016 17:47,Twitter for iPhone,This is Smokey. He really likes tennis balls. 11/10 https://t.co/Ah7WlYTUBQ,,,"https://twitter.com/dog_rates/status/708711088997666817/photo/1,https://twitter.com/dog_rates/status/708711088997666817/photo/1",11,10,Smokey,,,,,,1.1,German_short-haired_pointer,638,2334
7.0848E+17,,,3/12/2016 2:28,Twitter for iPhone,Meet Bear. He's a Beneboop Cumberclap. Extremely unamused. 13/10 I'm in love with this picture https://t.co/uC8kUqAz0W,,,https://twitter.com/dog_rates/status/708479650088034305/photo/1,13,10,Bear,,,,,,1.3,Shih-Tzu,617,2338
7.0847E+17,,,3/12/2016 1:49,Twitter for iPhone,This is Bobble. He's a Croatian Galifianakis. Hears everything within 400 miles. 11/10 would snug diligently https://t.co/VwDc6PTDzk,,,https://twitter.com/dog_rates/status/708469915515297792/photo/1,11,10,Bobble,,,,,,1.1,Chihuahua,729,2850
7.08356E+17,,,3/11/2016 18:18,Twitter for iPhone,This is Oliver. That is his castle. He protects it with his life. He's also squishy af. 10/10 would squish softly https://t.co/oSuEGw0BhX,,,"https://twitter.com/dog_rates/status/708356463048204288/photo/1,https://twitter.com/dog_rates/status/708356463048204288/photo/1",10,10,Oliver,,,,,,1,pug,1199,3306
7.08349E+17,,,3/11/2016 17:50,Twitter for iPhone,This is River. He's changing the trumpet game. Innovative af. 11/10 such a good boy https://t.co/tK7a0AxQfd,,,https://twitter.com/dog_rates/status/708349470027751425/photo/1,11,10,River,,,,,,1.1,basenji,676,2185
7.08149E+17,,,3/11/2016 4:35,Twitter for iPhone,This is Jebberson. He's the reigning hide and seek world champion. 10/10 hasn't lost his touch https://t.co/VEFkvWCoHF,,,https://twitter.com/dog_rates/status/708149363256774660/photo/1,10,10,Jebberson,,,,,,1,Cardigan,1412,3987
7.08131E+17,,,3/11/2016 3:22,Twitter for iPhone,Please stop sending in non canines like this Guatemalan Twiggle Bunny. We only rate dogs. Only send in dogs... 11/10 https://t.co/XKhobeGuvT,,,https://twitter.com/dog_rates/status/708130923141795840/photo/1,11,10,,,,,,,1.1,French_bulldog,784,3098
7.08119E+17,,,3/11/2016 2:36,Twitter for iPhone,This is Cooper. He basks in the glory of rebellion. 9/10 probably a preteen https://t.co/kDamUfeIpm,,,https://twitter.com/dog_rates/status/708119489313951744/photo/1,9,10,Cooper,,,,,,0.9,Norwich_terrier,896,2478
7.08109E+17,,,3/11/2016 1:56,Twitter for iPhone,This is Remington. He was caught off guard by the magical floating cheese. Spooked af. 10/10 deep breaths pup https://t.co/mhPSADiJmZ,,,https://twitter.com/dog_rates/status/708109389455101952/photo/1,10,10,Remington,,,,,,1,Staffordshire_bullterrier,501,1800
7.08026E+17,,,3/10/2016 20:26,Twitter for iPhone,Everybody stop what you're doing and watch this video. Frank is stuck in a loop. 13/10 (Vid by @klbmatty) https://t.co/5AJs8TIV1U,,,https://twitter.com/dog_rates/status/708026248782585858/video/1,13,10,,,,,,,1.3,malinois,1749,4062
7.07996E+17,,,3/10/2016 18:25,Twitter for iPhone,This is Farfle. He lost his back legs during the Battle of Gettysburg. Goes 0-60 in 4.3 seconds (damn) 12/10 hero af https://t.co/NiQQWzIzzq,,,https://twitter.com/dog_rates/status/707995814724026368/photo/1,12,10,Farfle,,,,,,1.2,,1013,2864
7.0797E+17,,,3/10/2016 16:42,Twitter for iPhone,Meet Rufus. He's a Honeysuckle Firefox. Curly af. Badass tie. About to go on his first date ever 11/10 good luck pup https://t.co/dGoTWNfIsm,,,https://twitter.com/dog_rates/status/707969809498152960/photo/1,11,10,Rufus,,,,,,1.1,toy_poodle,867,2484
7.07777E+17,,,3/10/2016 3:55,Twitter for iPhone,This is Sadie. She's a Bohemian Rhapsody. Remarkably portable. Could sneak on roller coasters with (probably). 11/10 https://t.co/DB8fyeDs8B,,,https://twitter.com/dog_rates/status/707776935007539200/photo/1,11,10,Sadie,,,,,,1.1,miniature_pinscher,872,3006
7.07742E+17,,,3/10/2016 1:35,Twitter for iPhone,When your roommate eats your leftover Chili's but you pretend it's no big deal cuz you fat anyway. 10/10 head up pup https://t.co/0nMgoue8IR,,,https://twitter.com/dog_rates/status/707741517457260545/photo/1,10,10,,,,,,,1,whippet,555,2289
7.07694E+17,,,3/9/2016 22:24,Twitter for iPhone,This is Jiminus. He's in a tub for some reason. What a jokester. Smh 7/10 churlish af https://t.co/84L4ED9Tpi,,,https://twitter.com/dog_rates/status/707693576495472641/photo/1,7,10,Jiminus,,,,,,0.7,,915,3123
7.07611E+17,,,3/9/2016 16:56,Twitter for iPhone,This is Harper. She scraped her elbow attempting a backflip off a tree. Valiant effort tho. 12/10 https://t.co/oHKJHghrp5,,,https://twitter.com/dog_rates/status/707610948723478529/photo/1,12,10,Harper,,,,,,1.2,golden_retriever,5714,15582
7.07421E+17,,,3/9/2016 4:19,Twitter for iPhone,This is Keurig. He's a rare dog. Laughs like an idiot tho. Head is basically a weapon. Poorly maintained goatee 4/10 https://t.co/xOrUyj7K30,,,https://twitter.com/dog_rates/status/707420581654872064/photo/1,4,10,Keurig,,,,,,0.4,kuvasz,632,2070
7.07412E+17,,,3/9/2016 3:45,Twitter for iPhone,"""I shall trip the big pupper with leash. Big pupper will never see it coming. I am a genius."" Both 11/10 https://t.co/uQsCJ8pf51",,,https://twitter.com/dog_rates/status/707411934438625280/photo/1,11,10,,,,pupper,,pupper,1.1,Lakeland_terrier,543,2112
7.07388E+17,,,3/9/2016 2:08,Twitter for iPhone,Meet Clarkus. He's a Skinny Eastern Worcestershire. Can tie own shoes (impressive af) 10/10 would put on track team https://t.co/XP5o7zGn0E,,,https://twitter.com/dog_rates/status/707387676719185920/photo/1,10,10,Clarkus,,,,,,1,Chihuahua,1147,3217
7.07377E+17,,,3/9/2016 1:26,Twitter for iPhone,This dog just brutally murdered a snowman. Currently toying with its nutritious remains 9/10 would totally still pet https://t.co/iKThgKnW1j,,,"https://twitter.com/dog_rates/status/707377100785885184/photo/1,https://twitter.com/dog_rates/status/707377100785885184/photo/1",9,10,,,,,,,0.9,golden_retriever,974,3009
